{
  "book": "Matthew",
  "bookSlug": "matthew",
  "chapter": 12,
  "verseStart": 46,
  "verseEnd": 50,
  "translation": "WEB",
  "title": "Matthew 12:46–50",
  "context": "After the demand for a sign and the warning about the returning unclean spirit (12:38–45), Matthew closes the chapter with a family interruption: while Jesus is still speaking, His mother and brothers stand outside asking to speak with Him—and He redefines true kinship around discipleship and the Father’s will.",
  "showVoices": true,
  "voices": {
    "eyebrow": "From the tradition",
    "heading": "Voices from both camps",
    "intro": "What earlier interpreters on each side wrote about Matthew 12:46–50.",
    "note": "Quotations lightly abridged for length; wording follows standard English translations of the sources named.",
    "arminian": [
      {
        "quote": "His brethren — his kinsmen: they were the sons of Mary, the wife of Cleopas, or Alpheus, his mother's sister; and came now seeking to take him, as one beside himself, Mark iii, 21. Mark iii, 31; Luke viii, And he answering, said - Our Lord's knowing why they came, sufficiently justifies his seeming disregard of them.",
        "cite": "John Wesley",
        "source": "Explanatory Notes upon the New Testament (on Matt 12:46–50)"
      }
    ],
    "reformed": [
      {
        "quote": "These words were unquestionably intended to reprove Mary's eagerness, and she certainly acted improperly in attempting to interrupt the progress of his discourse. At the same time, by disparaging the relationship of flesh and blood, our Lord teaches a very useful doctrine; for he admits all his disciples and all believers to the same honorable rank, as if they were his nearest relatives, or rather he places them in the room of his mother and brethren Now this statement is closely connected with the office of Christ; for he tells us that he has been given, not to a small number of individuals, but to all the godly, who are united in one body with him by faith.",
        "cite": "John Calvin",
        "source": "Commentary on a Harmony of the Evangelists (on Matt 12:46–50)"
      }
    ]
  },
  "verses": [
    {
      "number": 46,
      "text": "While he was yet speaking to the multitudes, behold, his mother and his brothers stood outside, seeking to speak to him.",
      "arminianNotes": "The scene is tender and tense at once: Mary and Jesus’ brothers stand outside while He teaches. Natural family love seeks Him, yet the moment will expose a deeper belonging than blood alone.\n\nArminian interpreters honor earthly family as God’s good gift without making it ultimate. Grace does not despise mothers and brothers; it places them under the higher claim of the kingdom. Hearers are invited to love their households—and to refuse letting kinship veto the call of Christ.",
      "reformedNotes": "Matthew’s “While he was yet speaking” ties this interruption to the preceding confrontation. The Messiah’s public word is not paused for private privilege; even His own household arrives as petitioners “outside.”\n\nReformed reading hears providence and christology: the Son’s mission defines the moment. Natural ties are true and precious, yet they are not the center of the kingdom. The narrative prepares a redefinition of family under the Father’s will."
    },
    {
      "number": 47,
      "text": "One said to him, “Behold, your mother and your brothers stand outside, seeking to speak to you.”",
      "arminianNotes": "A messenger reports the request: kinship waits outside and asks for speech with Jesus. The notice is respectful; nothing here mocks Mary. The issue is priority, not contempt for family.\n\nArminian pastoral care holds both truths: honor father and mother, and follow Jesus when discipleship costs. Grace enables a willing yes to Christ that does not hate family, yet will not let family become an idol that keeps us “outside” His word.",
      "reformedNotes": "The report makes the contrast vivid: those who share His blood stand outside; those who hear His teaching are within earshot of the Word. Matthew does not demean Mary; he relativizes every natural claim beside the Son’s authority.\n\nThe Word of Christ creates a new household. Information about biological kin is not ignored, but it cannot override the Father’s purpose unfolding in the Son’s teaching."
    },
    {
      "number": 48,
      "text": "But he answered him who spoke to him, “Who is my mother? Who are my brothers?”",
      "arminianNotes": "Jesus answers with a searching question, not a dismissal of love. “Who is my mother? Who are my brothers?” reopens the definition of belonging so that grace can redraw the circle.\n\nListen here for a responsible summons: examine where your deepest allegiance lies. The question invites every hearer—family member or stranger—to enter true kinship by trusting and obeying Him, without pretending blood alone guarantees kingdom membership.",
      "reformedNotes": "The counter-question is royal and revelatory. Jesus does not ask because He is confused about Mary; He asks to teach what constitutes His true family under heaven’s rule.\n\nChrist Himself defines His household. Belonging is not negotiated by pedigree, proximity, or presumption, but granted and marked according to the Father’s will as the Son discloses it."
    },
    {
      "number": 49,
      "text": "He stretched out his hand toward his disciples, and said, “Behold, my mother and my brothers!",
      "arminianNotes": "The gesture is pastoral and public: He stretches out His hand toward His disciples and names them as mother and brothers. Discipleship becomes the visible sign of true family.\n\nArminians gladly preach this wideness: those who follow Jesus are brought near as kin. The invitation is sincere—here are points to historical people who have responded—and it calls others to the same grace-enabled following that makes strangers into siblings.",
      "reformedNotes": "Hand and word agree: the disciples are identified as His family. Not crowd curiosity, not bloodline pride, but those gathered to Him as learners are named mother and brothers.\n\nChrist constitutes His household. The church’s deepest bond is union with the Son, displayed in discipleship. Earthly family remains gift; this family is kingdom reality created by His call.",
      "keyContrast": "Both confess that discipleship, not blood alone, marks Jesus’ true family. Arminians emphasize the sincere, grace-enabled call to follow and so enter that kinship; Calvinists typically highlight that Christ effectually gathers and names His own as the household He Himself constitutes."
    },
    {
      "number": 50,
      "text": "For whoever does the will of my Father who is in heaven, he is my brother, and sister, and mother.”",
      "arminianNotes": "The “for” grounds the claim: true kinship is doing the will of Jesus’ Father in heaven. “Whoever” is wonderfully wide—brother, sister, and mother language opens the family to all who obey from the heart.\n\nArminians stress grace-enabled responsibility: the Father’s will is not a cold checklist but living discipleship under the Son. Assurance grows as we trust Christ and walk in the Father’s will; the warning stands that mere proximity or pedigree without obedient faith is not enough.",
      "reformedNotes": "Obedience to the Father’s will is the family mark because the Son makes the Father known and forms a people who do what the Father wills. “Whoever” is expansive in reach and exacting in nature.\n\nDoing the Father’s will is fruit of new birth and union with Christ, not a ladder into the family by unaided effort. Those justified in the Son are also sanctified into a household that loves the Father’s will—and finds in Jesus a Brother who is not ashamed to call them siblings.",
      "keyContrast": "Shared confession: whoever does the Father’s will is Jesus’ true family. Arminians commonly accent the wide “whoever” as a grace-enabled call into responsible obedience that marks discipleship; Reformed theology commonly accents that such obedience is the Spirit-wrought fruit of the Father’s effectual purpose in those the Son claims as His own."
    }
  ]
}
