{
  "book": "John",
  "bookSlug": "john",
  "chapter": 13,
  "verseStart": 18,
  "verseEnd": 30,
  "translation": "WEB",
  "title": "John 13:18–30",
  "context": "He is not speaking of all of them. Scripture must be fulfilled: he who ate bread lifted his heel. He tells them before it happens so they will believe. The one who receives whom He sends receives Him and the Sender. Troubled in spirit, He discloses that one will betray Him. The beloved disciple, at Peter’s nod, asks who. Jesus dips the morsel, gives it to Judas; Satan enters him. “What you do, do quickly.” Judas goes out. It was night.",
  "showVoices": true,
  "voices": {
    "eyebrow": "From the tradition",
    "heading": "Voices from both camps",
    "intro": "On the betrayer at the table and the night he entered, a few classic voices from each tradition.",
    "note": "Quotations lightly abridged for length; wording follows standard English translations of the sources named.",
    "arminian": [
      {
        "quote": "I speak not of you all; I know whom I have chosen. He it is to whom I shall give a sop. After the sop, Satan entered into him. He then having received the sop went immediately out: and it was night.",
        "cite": "John Wesley",
        "source": "Explanatory Notes upon the New Testament (on John 13:18, 26–30)"
      }
    ],
    "reformed": [
      {
        "quote": "I know whom I have chosen. The Scripture must be fulfilled. Satan entered into him: he was already the devil’s, and now is given up. It was night: a fit time for the work of darkness.",
        "cite": "John Calvin",
        "source": "Commentary on John (on John 13:18, 27, 30)"
      }
    ]
  },
  "verses": [
    {
      "number": 18,
      "text": "I don’t speak concerning all of you. I know whom I have chosen; but that the Scripture may be fulfilled, ‘He who eats bread with me has lifted up his heel against me.’",
      "arminianNotes": "Not all; I know whom I have chosen. Psalm 41 must be fulfilled in a table-companion’s heel. Wesley noted the not-all.\n\nChosen here is the Eleven in contrast to Judas—His knowing is not confusion. Fulfillment does not make Judas a victim without a heel of his own; lifting the heel is still his act.",
      "reformedNotes": "Calvin: I know whom I have chosen. Scripture must be fulfilled.\n\nJesus’ knowledge of His chosen and Scripture’s must sit together with Judas’s treachery. The heel is guilty and written.",
      "keyContrast": "Jesus knows His chosen; Scripture is fulfilled in the betrayer at bread. Arminians typically refuse to let fulfillment erase Judas’s agency. Reformed commentators often refuse to let agency erase that Jesus knew and Scripture stood."
    },
    {
      "number": 19,
      "text": "From now on, I tell you before it happens, that when it happens, you may believe that I am he.",
      "arminianNotes": "Told beforehand so that when it happens they may believe that I am. Betrayal itself becomes a faith-argument.\n\nHe wants their believing to survive the scandal. The I am is the point, even of this wound.",
      "reformedNotes": "He tells them before it happens, so that when it happens they may believe that I am he.\n\nThe treachery will confirm, not cancel, His identity for those who remember this sentence."
    },
    {
      "number": 20,
      "text": "Most certainly I tell you, he who receives whomever I send, receives me; and he who receives me, receives him who sent me.”",
      "arminianNotes": "Whoever receives the sent receives Jesus and the Father. Mission is personal identification.\n\nAfter a betrayal warning, a reception promise. The church’s sent ones still carry this whoever of welcome.",
      "reformedNotes": "Truly, truly: chained reception—sent / me / Sender.\n\nTo receive His messenger is to receive the chain of God. Judas’s going out does not void this for the others He will send."
    },
    {
      "number": 21,
      "text": "When Jesus had said this, he was troubled in spirit, and testified, “Most certainly I tell you that one of you will betray me.”",
      "arminianNotes": "Troubled in spirit, then the testimony: one of you. Love to the end includes this distress.\n\nJesus is no stoic. The betrayal of a friend wrenches Him, and He still tells the truth.",
      "reformedNotes": "Jesus is troubled in spirit and testifies with a solemn “most certainly.” One of you—the circle is the wound.\n\nThe Word made flesh is troubled. Disclosure is costly and necessary."
    },
    {
      "number": 22,
      "text": "The disciples looked at one another, perplexed about whom he spoke.",
      "arminianNotes": "Looks around the table, uncertainty. No one points first at Judas.\n\nThey examine one another, even themselves (in the Synoptics). Uncertainty is healthier than “not me.”",
      "reformedNotes": "Uncertain of whom: the secret is not obvious to flesh.\n\nThe betrayer is still in their fellowship-sight as one of them."
    },
    {
      "number": 23,
      "text": "One of his disciples, whom Jesus loved, was at the table, leaning against Jesus’ chest.",
      "arminianNotes": "The beloved, at His side. Love named as the disciple’s identity in this Gospel.\n\nReclining at His side is John’s picture of the share Peter feared to lose. Intimacy is gift.",
      "reformedNotes": "Whom Jesus loved: the narrator’s name for himself or his figure.\n\nThe side-place will be the asking-place (v. 25). Love here is Jesus’ love."
    },
    {
      "number": 24,
      "text": "Simon Peter therefore beckoned to him, and said to him, “Tell us who it is of whom he speaks.”",
      "arminianNotes": "Peter prompts the one closer. Hierarchy of access at a table.\n\nWe often need a brother to ask the question we cannot. Peter’s motion is not cowardice only; it is using the beloved’s place.",
      "reformedNotes": "Motioned to ask: Peter still leading from a seat not the bosom.\n\nTwo disciples, one question, the Lord’s answer with a morsel."
    },
    {
      "number": 25,
      "text": "He, leaning back, as he was, on Jesus’ chest, asked him, “Lord, who is it?”",
      "arminianNotes": "Leaning back against Jesus, Lord, who is it? The question is whispered from contact.\n\nWho-is-it is asked from against-Him, not from a cold row.",
      "reformedNotes": "Leaning back: the physical of 13:23 becomes speech.\n\nThe beloved puts Peter’s question into the Lord’s ear."
    },
    {
      "number": 26,
      "text": "Jesus therefore answered, “It is he to whom I will give this piece of bread when I have dipped it.” So when he had dipped the piece of bread, he gave it to Judas, the son of Simon Iscariot.",
      "arminianNotes": "The sign is a dipped morsel given. The honored gesture of giving the morsel identifies the betrayer. He gives bread to the heel-lifter.\n\nThe last gift before the night is food from Jesus’ hand. Judas receives bread and will not receive the Lord.",
      "reformedNotes": "Morsel dipped and given: the named man is Judas son of Simon.\n\nNo riddle left for the beloved. The gift of bread and the gift of identity fall on the same man."
    },
    {
      "number": 27,
      "text": "After the piece of bread, then Satan entered into him. Then Jesus said to him, “What you do, do quickly.”",
      "arminianNotes": "After the morsel, Satan entered. Then Jesus’ do quickly. Agency is layered: Satan, Judas, and Jesus’ command to hasten.\n\nEntering does not erase Judas’s going-to-do. He is not excused as occupied housing; he is told to do what he is going to do, and he will walk out.",
      "reformedNotes": "Calvin: already the devil’s, now given up. Do quickly is not permission as approval; it is sovereign haste over a chosen evil.\n\nSatan enters, and the hour moves at Jesus’ word. Darkness does not seize the timetable."
    },
    {
      "number": 28,
      "text": "Now nobody at the table knew why he said this to him.",
      "arminianNotes": "The table does not understand do quickly. Even with the morsel, they miss.\n\nSpiritual crisis can sit in a room of friends who are still thinking about groceries (v. 29).",
      "reformedNotes": "No one knew why. The beloved may know who, not yet why the quickly.\n\nJesus and Judas share a meaning the others do not."
    },
    {
      "number": 29,
      "text": "For some thought, because Judas had the money box, that Jesus said to him, “Buy what things we need for the feast,” or that he should give something to the poor.",
      "arminianNotes": "Moneybag logic: feast or poor. They interpret in the only ledger they have.\n\nGood guesses (charity, feast) can be completely wrong. We still baptize others’ exits with innocent errands.",
      "reformedNotes": "Treasurer explanations. Feast / poor: reasonable and false.\n\nThe thief of 12:6 is thought to be on a mercy run. Night will correct the minutes."
    },
    {
      "number": 30,
      "text": "Therefore having received that morsel, he went out immediately. It was night.",
      "arminianNotes": "Wesley and Calvin both felt the night. Light has come; a man walks into dark with bread from Jesus still in the story.\n\nGoing out is chosen motion into night. The hour of 13:1 is now Judas’s hour too, and the door was not locked.",
      "reformedNotes": "Calvin: a fit time for the work of darkness. Immediately went out.\n\nThe word “night” means more than the time on the clock. John 1’s darkness, 3:19’s loved dark, here walks on two feet."
    }
  ]
}
