{
  "book": "Matthew",
  "bookSlug": "matthew",
  "chapter": 4,
  "verseStart": 23,
  "verseEnd": 25,
  "translation": "WEB",
  "title": "Matthew 4:23–25",
  "context": "Jesus travels throughout Galilee teaching in synagogues, proclaiming the Good News of the Kingdom, and healing every disease and affliction; fame spreads to Syria, the sick are brought, and great crowds follow from Galilee, the Decapolis, Jerusalem, Judea, and beyond the Jordan.",
  "showVoices": true,
  "voices": {
    "eyebrow": "From the tradition",
    "heading": "Voices from both camps",
    "intro": "Older voices from both traditions on Matthew 4:23–25.",
    "note": "Quotations lightly abridged for length; wording follows standard English translations of the sources named.",
    "arminian": [
      {
        "quote": "The Gospel of the kingdom - The Gospel, that is, the joyous message, is the proper name of our religion: as will be amply verified in all who earnestly and perseveringly embrace it. Through all Syria - The whole province, of which the Jewish country was only a small part.",
        "cite": "John Wesley",
        "source": "Explanatory Notes upon the New Testament (on Matt 4:23–25)"
      }
    ],
    "reformed": [
      {
        "quote": "As this history is placed by Luke after the two miracles, which we shall afterwards see, an opinion has commonly prevailed, that the miracle, which is here related by him, was performed some time after that they had been called by Christ. But the reason, which they allege, carries little weight: for no fixed and distinct order of dates was observed by the Evangelists in composing their narratives.",
        "cite": "John Calvin",
        "source": "Commentary on a Harmony of the Evangelists (on Matt 4:23–25)"
      }
    ]
  },
  "verses": [
    {
      "number": 23,
      "text": "Jesus went about in all Galilee, teaching in their synagogues, preaching the Good News of the Kingdom, and healing every disease and every sickness among the people.",
      "arminianNotes": "A threefold ministry: teaching, proclaiming kingdom gospel, healing. Word and mercy travel together through all Galilee.\n\nThe good news is announced widely in synagogues and towns. Grace that heals bodies also invites hearts—sincere proclamation paired with compassion.",
      "reformedNotes": "The Messiah’s program is comprehensive under providence: synagogue teaching, kingdom proclamation, and healing authority.\n\n“every disease and every sickness” signals royal power, not limited technique. The King who calls disciples now displays the kingdom’s arrival in word and deed."
    },
    {
      "number": 24,
      "text": "The report about him went out into all Syria. They brought to him all who were sick, afflicted with various diseases and torments, possessed with demons, epileptics, and paralytics; and he healed them.",
      "arminianNotes": "Fame crosses into Syria; crowds bring every kind of misery—disease, pain, demons, seizures, paralysis. Jesus heals them.\n\nArminian readers see open-handed mercy: sufferers are brought, and He heals. The narrative invites trust—come with what oppresses you; the Physician is willing.",
      "reformedNotes": "Report runs ahead of Him; need streams toward Him. Categories of suffering pile up, and He heals them all in Matthew’s summary.\n\nAuthority over body and demon is the Son’s. Fame is providence’s megaphone so that the afflicted may be carried to the only sufficient Healer.",
      "keyContrast": "Both glory in Christ’s healing mercy. Arminians typically stress a wide, sincere compassion that welcomes all who are brought; Reformed interpreters emphasize sovereign power that actually heals as the kingdom advances on God’s schedule."
    },
    {
      "number": 25,
      "text": "Great multitudes from Galilee, Decapolis, Jerusalem, Judea, and from beyond the Jordan followed him.",
      "arminianNotes": "Great crowds from north, east, south, and across the Jordan—Jew and Gentile regions alike. The light in Galilee draws a wide following.\n\nThe invitation’s reach matches Isaiah’s Gentile Galilee. Many follow; each still must move from crowd to disciple under grace.",
      "reformedNotes": "Geography of followers maps the promise: Galilee, Decapolis, Jerusalem, Judea, beyond the Jordan. The King’s draw is already regional.\n\nCrowds are not the final measure, yet they signal that God is gathering. The very Lord who called four from nets now pulls multitudes—preparing the Sermon on the Mount and the sharper calls still to come."
    }
  ]
}
