{
  "book": "Revelation",
  "bookSlug": "revelation",
  "chapter": 18,
  "verseStart": 9,
  "verseEnd": 24,
  "translation": "WEB",
  "title": "Revelation 18:9–24",
  "context": "Kings, merchants, and seafarers mourn Babylon’s fall from a distance as her wealth vanishes in an hour. Heaven, saints, apostles, and prophets are called to rejoice, because God has judged her. A mighty angel throws a millstone into the sea as a sign that the city will be found no more, for in her was found the blood of prophets and saints.",
  "showVoices": false,
  "verses": [
    {
      "number": 9,
      "text": "The kings of the earth who committed sexual immorality and lived wantonly with her will weep and wail over her, when they look at the smoke of her burning,",
      "arminianNotes": "The kings who shared her luxury weep.",
      "reformedNotes": "Reformed readers see the grief of those whose hopes were in the world."
    },
    {
      "number": 10,
      "text": "standing far away for the fear of her torment, saying, ‘Woe, woe, the great city, Babylon, the strong city! For your judgment has come in one hour.’",
      "arminianNotes": "They stand far off, afraid of her torment.",
      "reformedNotes": "Reformed readers see self-interest even in mourning."
    },
    {
      "number": 11,
      "text": "The merchants of the earth weep and mourn over her, for no one buys their merchandise any more:",
      "arminianNotes": "The merchants weep because no one buys their goods.",
      "reformedNotes": "Reformed readers see grief over lost profit."
    },
    {
      "number": 12,
      "text": "merchandise of gold, silver, precious stones, pearls, fine linen, purple, silk, scarlet, all expensive wood, every vessel of ivory, every vessel made of most precious wood, and of brass, and iron, and marble;",
      "arminianNotes": "Luxury goods are listed: gold, silver, jewels, fine cloth.",
      "reformedNotes": "Reformed readers see the wealth of the world system."
    },
    {
      "number": 13,
      "text": "and cinnamon, incense, perfume, frankincense, wine, olive oil, fine flour, wheat, cattle, sheep, horses, chariots, and people’s bodies and souls.",
      "arminianNotes": "The list ends with bodies and human souls, a condemnation of the slave trade.",
      "reformedNotes": "Reformed readers see the dehumanizing cost of the world’s commerce."
    },
    {
      "number": 14,
      "text": "The fruits which your soul lusted after have been lost to you. All things that were dainty and sumptuous have perished from you, and you will find them no more at all.",
      "arminianNotes": "The fruit her soul desired is gone.",
      "reformedNotes": "Reformed readers see the emptiness of worldly desire."
    },
    {
      "number": 15,
      "text": "The merchants of these things, who were made rich by her, will stand far away for the fear of her torment, weeping and mourning,",
      "arminianNotes": "The merchants stand far off.",
      "reformedNotes": "Reformed readers see the same distancing."
    },
    {
      "number": 16,
      "text": "saying, ‘Woe, woe, the great city, she who was dressed in fine linen, purple, and scarlet, and decked with gold and precious stones and pearls!",
      "arminianNotes": "They lament the city clothed in luxury.",
      "reformedNotes": "Reformed readers note the outward splendor."
    },
    {
      "number": 17,
      "text": "For in an hour such great riches are made desolate.’ Every ship master, and everyone who sails anywhere, and mariners, and as many as gain their living by sea, stood far away,",
      "arminianNotes": "In one hour such wealth is laid waste.",
      "reformedNotes": "Reformed readers see the suddenness of judgment."
    },
    {
      "number": 18,
      "text": "and cried out as they looked at the smoke of her burning, saying, ‘What is like the great city?’",
      "arminianNotes": "Seafarers cry, “What is like the great city?”",
      "reformedNotes": "Reformed readers see the world’s admiration for its own power."
    },
    {
      "number": 19,
      "text": "They cast dust on their heads, and cried, weeping and mourning, saying, ‘Woe, woe, the great city, in which all who had their ships in the sea were made rich by reason of her great wealth!’ For she is made desolate in one hour.",
      "arminianNotes": "They throw dust on their heads in grief.",
      "reformedNotes": "Reformed readers see mourning over lost wealth."
    },
    {
      "number": 20,
      "text": "“Rejoice over her, O heaven, you saints, apostles, and prophets, for God has judged your judgment on her.”",
      "arminianNotes": "Heaven, saints, apostles, and prophets rejoice because God has judged her. Arminian readers see justice for the persecuted rather than personal revenge.",
      "reformedNotes": "Reformed readers see vindication of God’s people and his justice."
    },
    {
      "number": 21,
      "text": "A mighty angel took up a stone like a great millstone and cast it into the sea, saying, “Thus with violence will Babylon, the great city, be thrown down, and will be found no more at all.",
      "arminianNotes": "A millstone thrown into the sea signals permanent destruction, as in Jeremiah 51:63–64.",
      "reformedNotes": "Reformed readers see final judgment."
    },
    {
      "number": 22,
      "text": "The voice of harpists, minstrels, flute players, and trumpeters will be heard no more at all in you. No craftsman of whatever craft will be found any more at all in you. The sound of a mill will be heard no more at all in you.",
      "arminianNotes": "Music and craft will be heard no more.",
      "reformedNotes": "Reformed readers see the end of ordinary life in the city."
    },
    {
      "number": 23,
      "text": "The light of a lamp will shine no more at all in you. The voice of the bridegroom and of the bride will be heard no more at all in you, for your merchants were the princes of the earth; for with your sorcery all the nations were deceived.",
      "arminianNotes": "Her sorceries deceived all nations.",
      "reformedNotes": "Reformed readers see deception at the heart of her power."
    },
    {
      "number": 24,
      "text": "In her was found the blood of prophets and of saints, and of all who have been slain on the earth.”",
      "arminianNotes": "The blood of prophets and saints was found in her.",
      "reformedNotes": "Reformed readers see persecution as the deepest charge."
    }
  ]
}
