{
  "book": "Revelation",
  "bookSlug": "revelation",
  "chapter": 22,
  "verseStart": 1,
  "verseEnd": 5,
  "translation": "WEB",
  "title": "Revelation 22:1–5",
  "context": "John’s vision of the new Jerusalem ends with Eden restored and surpassed. The river of the water of life flows from the throne of God and of the Lamb, and the tree of life bears fruit every month, its leaves for the healing of the nations. The curse is gone. God’s servants will see his face, bear his name, live in his light, and reign forever.",
  "showVoices": false,
  "verses": [
    {
      "number": 1,
      "text": "He showed me a river of water of life, clear as crystal, proceeding out of the throne of God and of the Lamb,",
      "arminianNotes": "The river flows from the throne of God and of the Lamb, so life comes from God and from the Lamb together. The image draws on Ezekiel 47 and Genesis 2. Arminian readers see the fulfillment of God’s purpose to restore life to his creation through Christ.",
      "reformedNotes": "Reformed readers note that the throne is shared by God and the Lamb, a strong testimony to Christ’s deity. Life flows from God’s sovereign rule, and the source of every blessing in the city is the throne itself."
    },
    {
      "number": 2,
      "text": "in the middle of its street. On this side of the river and on that was the tree of life, bearing twelve kinds of fruits, yielding its fruit every month. The leaves of the tree were for the healing of the nations.",
      "arminianNotes": "The tree of life, closed to humanity after the fall (Genesis 3:22–24), is open again. Its leaves are for the healing of the nations, a picture of the gospel’s reach to every people. Interpreters differ on whether to read the vision as a literal description of the new creation or as symbolic language for its reality, but most agree that it pictures full restoration.",
      "reformedNotes": "Reformed readers see the tree of life as the restoration of what was lost in Adam and secured in Christ, the last Adam. The healing of the nations shows the international scope of redemption, with people from every nation gathered in the city. Interpreters across views agree that the image conveys a complete restoration, whatever its level of literal detail."
    },
    {
      "number": 3,
      "text": "There will be no curse any more. The throne of God and of the Lamb will be in it, and his servants will serve him.",
      "arminianNotes": "“There will be no curse any more” answers Genesis 3. God’s servants will serve him in his presence. Arminian readers see the end of sin’s effects and the fulfillment of humanity’s calling to worship and serve God.",
      "reformedNotes": "Reformed readers see the curse removed because Christ bore it (Galatians 3:13). The throne of God and of the Lamb is at the center, and service to God is the joy of the redeemed."
    },
    {
      "number": 4,
      "text": "They will see his face, and his name will be on their foreheads.",
      "arminianNotes": "To see God’s face was denied even to Moses (Exodus 33:20). Here it is the privilege of all God’s servants. The name on their foreheads marks them as belonging to God, in contrast to the mark of the beast in chapter 13.",
      "reformedNotes": "Reformed readers often call this the beatific vision, the highest blessing of the redeemed. The name on the forehead signifies God’s ownership and the permanence of their belonging to him."
    },
    {
      "number": 5,
      "text": "There will be no night, and they need no lamp light or sun light; for the Lord God will illuminate them. They will reign forever and ever.",
      "arminianNotes": "The Lord God is their light, so no lamp or sun is needed. They will reign forever, sharing in Christ’s rule as he promised in 3:21. Arminian readers see the final reward of those who have persevered in faith.",
      "reformedNotes": "Reformed readers read the reign of the saints as their share in Christ’s kingdom, given by grace. Many Reformed interpreters emphasize that this eternal reign is the goal toward which the whole story of redemption moves."
    }
  ]
}
